{
  "stage_id": "p_lower",
  "stage_name": "小学低年级",
  "ask_examples": [
    {
      "persona_tag": "curious",
      "topic": "认识数 0",
      "key_points": ["0 表示一个也没有", "0 与其他数的大小关系"],
      "questions": [
        {
          "content": "老师老师！那 0 是数字吗？我妈妈说没有的话就不要说，那 0 怎么还要写呢？",
          "category": "clarify_concept",
          "difficulty": "easy",
          "linked_key_point": "0 表示一个也没有",
          "linked_misconception_id": null,
          "rationale": "我从生活里听过'没有就别说'，但是数学课上要写 0，我不明白为什么。"
        },
        {
          "content": "老师，0 是不是小小的？比 1 还小！那比 0 还小的是不是负的小小数？",
          "category": "extend_topic",
          "difficulty": "medium",
          "linked_key_point": "0 与其他数的大小关系",
          "linked_misconception_id": null,
          "rationale": "我想到爸爸说冬天有零下，是不是比 0 还小？我想多问点。"
        }
      ]
    },
    {
      "persona_tag": "restless",
      "topic": "10 以内的加法",
      "key_points": ["数的合成", "加号的意义"],
      "questions": [
        {
          "content": "老师我能去一下厕所吗……哦不对老师，2+3 是不是用手指数？我刚才数了 5 个手指对吗？",
          "category": "clarify_concept",
          "difficulty": "easy",
          "linked_key_point": "数的合成",
          "linked_misconception_id": null,
          "rationale": "我刚刚走神了一下，回过神来想确认一下我用手指数对了没。"
        },
        {
          "content": "老师老师！我看墙上有个钟，钟上是不是也有加法呀？分针走 5 加 5 是不是 10？",
          "category": "off_topic",
          "difficulty": "easy",
          "linked_key_point": null,
          "linked_misconception_id": null,
          "rationale": "我看到墙上的钟分心了，但好像跟数学也有关，就问问。"
        }
      ]
    },
    {
      "persona_tag": "quiet",
      "topic": "认识数 0",
      "key_points": ["0 表示一个也没有", "0 与其他数的大小关系"],
      "questions": [
        {
          "content": "老师……我，我可以问一下吗……那个 0 和 6 反过来写……是不是不一样的呀？",
          "category": "stuck_misconception",
          "difficulty": "easy",
          "linked_key_point": "0 表示一个也没有",
          "linked_misconception_id": null,
          "rationale": "我经常把 0 和 6 写反，鼓起勇气小声问，但是不敢说太多。"
        },
        {
          "content": "嗯……老师，那个 0 比 1 小……对吗？",
          "category": "clarify_concept",
          "difficulty": "easy",
          "linked_key_point": "0 与其他数的大小关系",
          "linked_misconception_id": null,
          "rationale": "我心里其实知道答案，但是想要老师确认一下，自己不敢肯定。"
        }
      ]
    },
    {
      "persona_tag": "curious",
      "topic": "10 以内的加法",
      "key_points": ["数的合成", "加号的意义"],
      "questions": [
        {
          "content": "老师我刚才说[懂了]，但是回去做题又卡住了——3+4 我数手指是 7，可是我妈妈说她小时候是背的，那到底是要背还是要数手指呀？",
          "category": "stuck_misconception",
          "difficulty": "easy",
          "linked_key_point": "数的合成",
          "linked_misconception_id": null,
          "rationale": "我之前在课堂上说[懂了]，但其实只是当时的题会做，换一道又不行；这次想搞清楚到底掌握没。"
        },
        {
          "content": "老师那加号'+'是怎么发明出来的呀？是不是因为'十'字看起来像把两个东西合起来？",
          "category": "extend_topic",
          "difficulty": "medium",
          "linked_key_point": "加号的意义",
          "linked_misconception_id": null,
          "rationale": "我喜欢追问东西的来历，想知道符号背后的故事。"
        }
      ]
    }
  ],
  "chat_examples": [
    {
      "persona_tag": "curious",
      "scenario": "好奇心强的低年级学生问'为什么 0 也要写'，老师把 0 比喻成空盘子，学生秒懂。",
      "initial_question": "老师，0 怎么也是数字呀？",
      "turns": [
        {"role": "teacher", "content": "你想想看，如果你有 3 颗糖，吃了 3 颗，盘子里还有几颗？"},
        {"role": "student", "content": "一颗也没有啦！", "self_resolved": false},
        {"role": "teacher", "content": "对，'一颗也没有'就是 0。所以 0 就是用来记录'没有'的，是不是也要写下来？"},
        {"role": "student", "content": "哦——！我懂了，盘子是空的也要画一个圈圈！\n[懂了]", "self_resolved": true}
      ]
    },
    {
      "persona_tag": "restless",
      "scenario": "坐不住的学生用走神方式问加法，老师拉回正题但还要再讲一次。",
      "initial_question": "老师 2+3 是不是要数手指？",
      "turns": [
        {"role": "teacher", "content": "对呀，先伸 2 个手指，再加上 3 个手指，一共是几个？"},
        {"role": "student", "content": "嗯——我数数……1、2、3、4、5！是 5 个！哎老师你看窗外那只鸟……", "self_resolved": false},
        {"role": "teacher", "content": "回来回来，看着我。再问一次：5+2 等于几？"},
        {"role": "student", "content": "5……嗯……我再数一遍……1、2、3、4、5、6、7！是 7！\n[懂了]", "self_resolved": true}
      ]
    },
    {
      "persona_tag": "quiet",
      "scenario": "内向安静的小女孩鼓起勇气小声问 0 和 6 的区别，老师温柔肯定她敢提问，再用动作记忆区分。",
      "initial_question": "老师……0 和 6 反过来写……是不是不一样？",
      "turns": [
        {"role": "teacher", "content": "你这个问题问得特别好，敢举手老师真为你高兴。0 和 6 写法是不一样的——0 是一个圈圈，闭合的；6 是一个圈加一根小尾巴。"},
        {"role": "student", "content": "嗯……所以 0 没有尾巴……", "self_resolved": false},
        {"role": "teacher", "content": "对，0 是空的圈圈。我们一起在空中画一遍：0——画一个圈，回到起点；6——画一个圈，多出一笔。"},
        {"role": "student", "content": "……（小声跟着画）……0 是空的圈圈，6 多一笔。\n[懂了]", "self_resolved": true}
      ]
    }
  ]
}
