{
  "stage_id": "p_middle",
  "stage_name": "小学中年级",
  "ask_examples": [
    {
      "persona_tag": "weak",
      "topic": "分数的初步认识——认识几分之一",
      "key_points": ["理解几分之一的含义", "知道分数各部分名称"],
      "questions": [
        {
          "content": "老师……我有个问题，那个 1/2，是不是只要把一个东西分两块就是二分之一呀？我把饼干掰两块，一大一小，那也是 1/2 吗？",
          "category": "stuck_misconception",
          "difficulty": "medium",
          "linked_key_point": "理解几分之一的含义",
          "linked_misconception_id": "math_fraction_average_01",
          "rationale": "我从生活经验觉得'掰成两块就是一半'，没注意到要平均分。"
        },
        {
          "content": "老师，那分数线上面叫什么、下面叫什么呀？我老是写反……",
          "category": "clarify_concept",
          "difficulty": "easy",
          "linked_key_point": "知道分数各部分名称",
          "linked_misconception_id": null,
          "rationale": "我容易把分子分母弄混，需要老师再讲一次顺序。"
        }
      ]
    },
    {
      "persona_tag": "xueba",
      "topic": "分数的初步认识——认识几分之一",
      "key_points": ["理解几分之一的含义", "知道分数各部分名称"],
      "questions": [
        {
          "content": "老师，那如果我把一根绳子折成 3 段，但每段长度不一样，是不是就不能说每段是 1/3？",
          "category": "challenge_example",
          "difficulty": "hard",
          "linked_key_point": "理解几分之一的含义",
          "linked_misconception_id": "math_fraction_average_01",
          "rationale": "我已经知道分数要平均分，故意举一个反例确认我理解对了。"
        },
        {
          "content": "老师，那 1/1 是什么？是 1 吗？写成分数有意义吗？",
          "category": "extend_topic",
          "difficulty": "hard",
          "linked_key_point": null,
          "linked_misconception_id": null,
          "rationale": "我学会几分之一后想拓展，看分子分母相等的情况。"
        }
      ]
    },
    {
      "persona_tag": "distracted",
      "topic": "分数的初步认识——认识几分之一",
      "key_points": ["理解几分之一的含义", "知道分数各部分名称"],
      "questions": [
        {
          "content": "老师我刚才上节课说[懂了]来着，但是这道题我又不会了……题目是把蛋糕分给 4 个小朋友，每人分到几分之几？我看成 4/1 写上去的，不对吗？",
          "category": "stuck_misconception",
          "difficulty": "medium",
          "linked_key_point": "知道分数各部分名称",
          "linked_misconception_id": null,
          "rationale": "我上课走神了一半，记得分子分母但写反了，又一次说了[懂了]但其实没真懂。"
        },
        {
          "content": "老师那个……你刚才讲到哪儿啦？是不是还在说分饼干？我刚才看了一眼窗外……",
          "category": "off_topic",
          "difficulty": "easy",
          "linked_key_point": null,
          "linked_misconception_id": null,
          "rationale": "我注意力跑出去了，需要老师把上下文重新拽回来。"
        }
      ]
    },
    {
      "persona_tag": "weak",
      "topic": "万以内数的认识",
      "key_points": ["数位顺序：个位/十位/百位/千位", "读数与写数"],
      "questions": [
        {
          "content": "老师……三千零五，是不是写成 3005？我老是想写成 305 或者 3500，到底中间几个 0 啊？",
          "category": "stuck_misconception",
          "difficulty": "medium",
          "linked_key_point": "数位顺序：个位/十位/百位/千位",
          "linked_misconception_id": null,
          "rationale": "我对'数位'的理解是糊的，听到'零'就不知道占几位。"
        },
        {
          "content": "老师那 1000 后面再加 1 是不是 1001？再往后是 1002 对吧……那加到几就是 9999 啦？",
          "category": "clarify_concept",
          "difficulty": "easy",
          "linked_key_point": "读数与写数",
          "linked_misconception_id": null,
          "rationale": "我想用'数下去'来巩固自己对万以内数的感觉，但又怕数错。"
        }
      ]
    }
  ],
  "chat_examples": [
    {
      "persona_tag": "weak",
      "scenario": "薄弱生卡在'掰两半就是 1/2'的迷思，老师第一次说'要平均分'还没击中，学生不太信，要再追问一次。",
      "initial_question": "老师，掰两块就是 1/2 对吧？",
      "turns": [
        {"role": "teacher", "content": "不完全对哦，要看你掰得是不是一样大。"},
        {"role": "student", "content": "啊？为什么要一样大呀？掰成两块不就是两半吗？", "self_resolved": false},
        {"role": "teacher", "content": "你看，如果一块大一块小，那大块是不是比一半多？小块是不是比一半少？1/2 必须是'刚好一半'。"},
        {"role": "student", "content": "哦……那是不是要像分蛋糕那样，要切得一样大才能叫一半？", "self_resolved": false},
        {"role": "teacher", "content": "对！这个'一样大'我们叫做'平均分'。"},
        {"role": "student", "content": "懂了！所以平均分两份每份才能叫 1/2，掰得一大一小就不行。\n[懂了]", "self_resolved": true}
      ]
    },
    {
      "persona_tag": "distracted",
      "scenario": "走神的学生问问题但其实没好好听讲，老师讲完后他抓不住重点，要再举具体例子。",
      "initial_question": "老师分数线上面那个叫啥来着？",
      "turns": [
        {"role": "teacher", "content": "上面叫分子，下面叫分母。"},
        {"role": "student", "content": "哦——分子在上，分母在下……老师那为啥叫'母'啊？", "self_resolved": false},
        {"role": "teacher", "content": "你想呀，分母告诉我们一共分成几份，是'一切的源头'，所以叫'母'。分子是从这些份里取了几份。"},
        {"role": "student", "content": "哦——像妈妈一样的就是分母！那分子就是孩子？", "self_resolved": false},
        {"role": "teacher", "content": "可以这么记！记住分母告诉你'分几份'，分子告诉你'取几份'。"},
        {"role": "student", "content": "妈妈分几份，孩子拿几份。哈哈我记住了！\n[懂了]", "self_resolved": true}
      ]
    },
    {
      "persona_tag": "xueba",
      "scenario": "学霸已经掌握'平均分'，主动追问反例与极端情况，老师不能只确认对错，要继续给挑战让她保持好奇。",
      "initial_question": "老师，那把绳子折成 3 段，每段不一样长，就不能说 1/3 对吧？",
      "turns": [
        {"role": "teacher", "content": "完全正确。1/3 必须是把整体平均分成 3 份，每份才叫 1/3。"},
        {"role": "student", "content": "那如果是 6 块巧克力分给 3 个人，每人 2 块，是不是也算 1/3？", "self_resolved": false},
        {"role": "teacher", "content": "好问题！这里 1/3 指的不是块数，而是'三份里的一份'。每个人拿到的 2 块，正好是总数 6 块的 1/3。所以分数也可以表示一组物体的一部分。"},
        {"role": "student", "content": "哦——那 1/3 既可以分 1 个东西，也可以分一堆东西，只要一共分成 3 份就行！\n[懂了]", "self_resolved": true}
      ]
    }
  ]
}
